{
  "schema_version": 1,
  "campaign_id": "CMP_CONTAINER_001",
  "state": "INSTAGRAM_POSTED",
  "revision": 0,
  "identity": {
    "candidate_id": "CAND_CO_001",
    "offer_id": "CONTAINER_001",
    "merchant": "amazon.in",
    "asin": "B0753ZQDR7",
    "product_title": "Signoraware Family Fresh Tab BPA Free Plastic Containers Set | Microwave & Freezer safe | Airtight & Leakproof | Best for Kitchen & Outdoor Use (MultiColour | Setof4 | 2.5Ltr +1.2Ltr +500ml +160ml)",
    "variant": "MultiColour; Set of 4 (2.5L+1.2L+500ml+160ml)",
    "canonical_url": "https://www.amazon.in/dp/B0753ZQDR7",
    "affiliate_url": "https://www.amazon.in/dp/B0753ZQDR7?tag=rioaffiliate-21",
    "landing_page_url": "",
    "candidate_score": 95.0,
    "candidate_status": "READY",
    "selected_at": "2026-08-29T04:40+05:30",
    "offer_verified_at": "2026-08-16",
    "availability": "IN_STOCK",
    "evidence_refs": [
      "data/ig_published.json",
      "data/offer_identity_registry.csv",
      "data/product_candidates.csv"
    ]
  },
  "creative": null,
  "approvals": {
    "creative": null,
    "publish": null
  },
  "publish": {
    "attempts": 1,
    "idempotency_key": "legacy:17980069911095536",
    "precheck": null,
    "media_id": "17980069911095536",
    "permalink": "https://www.instagram.com/p/DcmgoR-kgAE/",
    "error": null
  },
  "governance": {
    "approval_model": "PRE_STEP_2_LEGACY",
    "legacy_import": true,
    "previous_state": null
  },
  "created_at": "2026-08-29T04:40+05:30",
  "updated_at": "2026-08-29T04:40+05:30",
  "history": [
    {
      "event_id": "260e6c90-f26f-52d2-a7d2-cc9f76516eaa",
      "campaign_id": "CMP_CONTAINER_001",
      "revision": 0,
      "action": "LEGACY_INSTAGRAM_POST_IMPORTED",
      "actor": {
        "id": "step-3-migration",
        "role": "MIGRATION"
      },
      "at": "2026-08-29T04:40+05:30",
      "from_state": null,
      "to_state": "INSTAGRAM_POSTED",
      "details": {
        "source": "data/ig_published.json",
        "approval_model": "PRE_STEP_2_LEGACY",
        "approvals_fabricated": false
      }
    }
  ]
}
