{
  "schema_version": 1,
  "campaign_id": "CMP_BABY_CORNERGUARD_001",
  "state": "INSTAGRAM_POSTED",
  "revision": 0,
  "identity": {
    "candidate_id": "CAND_CG_001",
    "offer_id": "BABY_CORNERGUARD_001",
    "merchant": "amazon.in",
    "asin": "B07NSQFTLH",
    "product_title": "AMAZARA Baby Corner Guards – Pre-Taped Safety Edge Protectors for Furniture | Childproof Foam Cushions with Strong 3M Adhesive | 10 Pcs, Brown | Baby Proofing",
    "variant": "Brown; 10 Pcs; Pre-Taped 3M Adhesive",
    "canonical_url": "https://www.amazon.in/dp/B07NSQFTLH",
    "affiliate_url": "https://www.amazon.in/dp/B07NSQFTLH?tag=rioaffiliate-21",
    "landing_page_url": "",
    "candidate_score": 91.0,
    "candidate_status": "READY",
    "selected_at": "2026-09-06T21:54+05:30",
    "offer_verified_at": "2026-08-17",
    "availability": "IN_STOCK",
    "evidence_refs": [
      "data/ig_published.json",
      "data/offer_identity_registry.csv",
      "data/product_candidates.csv"
    ]
  },
  "creative": null,
  "approvals": {
    "creative": null,
    "publish": null
  },
  "publish": {
    "attempts": 1,
    "idempotency_key": "legacy:17930672214393949",
    "precheck": null,
    "media_id": "17930672214393949",
    "permalink": "https://www.instagram.com/p/Dc89VC_nDEN/",
    "error": null
  },
  "governance": {
    "approval_model": "PRE_STEP_2_LEGACY",
    "legacy_import": true,
    "previous_state": null
  },
  "created_at": "2026-09-06T21:54+05:30",
  "updated_at": "2026-09-06T21:54+05:30",
  "history": [
    {
      "event_id": "13f5f556-4b1c-5cab-a0a4-c592c8b76641",
      "campaign_id": "CMP_BABY_CORNERGUARD_001",
      "revision": 0,
      "action": "LEGACY_INSTAGRAM_POST_IMPORTED",
      "actor": {
        "id": "step-3-migration",
        "role": "MIGRATION"
      },
      "at": "2026-09-06T21:54+05:30",
      "from_state": null,
      "to_state": "INSTAGRAM_POSTED",
      "details": {
        "source": "data/ig_published.json",
        "approval_model": "PRE_STEP_2_LEGACY",
        "approvals_fabricated": false
      }
    }
  ]
}
