{
  "schema_version": 1,
  "campaign_id": "CMP_BATHROOM_SHELF_001",
  "state": "INSTAGRAM_POSTED",
  "revision": 0,
  "identity": {
    "candidate_id": "CAND_BA_001",
    "offer_id": "BATHROOM_SHELF_001",
    "merchant": "amazon.in",
    "asin": "B0GYYRR5JB",
    "product_title": "EUDELE Aluminium Pack of 2, Self Adhesive Bathroom Shelf for Wall Shelf Organizer Wall Mounted Bathroom Shelves Rack Holder Stand for Bathroom Accessories Organiser Without Drill Black",
    "variant": "Black; Aluminium; Pack of 2; No-Drill Self-Adhesive",
    "canonical_url": "https://www.amazon.in/dp/B0GYYRR5JB",
    "affiliate_url": "https://www.amazon.in/dp/B0GYYRR5JB?tag=rioaffiliate-21",
    "landing_page_url": "",
    "candidate_score": 90.0,
    "candidate_status": "READY",
    "selected_at": "2026-09-01T01:04+05:30",
    "offer_verified_at": "2026-08-16",
    "availability": "IN_STOCK",
    "evidence_refs": [
      "data/ig_published.json",
      "data/offer_identity_registry.csv",
      "data/product_candidates.csv"
    ]
  },
  "creative": null,
  "approvals": {
    "creative": null,
    "publish": null
  },
  "publish": {
    "attempts": 1,
    "idempotency_key": "legacy:18114163570771311",
    "precheck": null,
    "media_id": "18114163570771311",
    "permalink": "https://www.instagram.com/p/Dct2X62FOl_/",
    "error": null
  },
  "governance": {
    "approval_model": "PRE_STEP_2_LEGACY",
    "legacy_import": true,
    "previous_state": null
  },
  "created_at": "2026-09-01T01:04+05:30",
  "updated_at": "2026-09-01T01:04+05:30",
  "history": [
    {
      "event_id": "767e2da2-cb01-5834-9c83-f20e5da32004",
      "campaign_id": "CMP_BATHROOM_SHELF_001",
      "revision": 0,
      "action": "LEGACY_INSTAGRAM_POST_IMPORTED",
      "actor": {
        "id": "step-3-migration",
        "role": "MIGRATION"
      },
      "at": "2026-09-01T01:04+05:30",
      "from_state": null,
      "to_state": "INSTAGRAM_POSTED",
      "details": {
        "source": "data/ig_published.json",
        "approval_model": "PRE_STEP_2_LEGACY",
        "approvals_fabricated": false
      }
    }
  ]
}
