{
  "schema_version": 1,
  "campaign_id": "CMP_TROLLEY_001",
  "state": "INSTAGRAM_POSTED",
  "revision": 0,
  "identity": {
    "candidate_id": "CAND_TR_001",
    "offer_id": "TROLLEY_001",
    "merchant": "amazon.in",
    "asin": "B08BVJYLZ3",
    "product_title": "Amazon Basics Slim Rolling Storage Rack – 3-Tiered Shelf Plastic Slide-Out Organizer | Space-Saving, Multipurpose | for Kitchen, Bathroom, Laundry, Pantry & Utility Storage | Floor Standing | White",
    "variant": "White; 3-Tier; 12.4D x 54.2W x 71.8H cm; wheeled, foldable",
    "canonical_url": "https://www.amazon.in/dp/B08BVJYLZ3",
    "affiliate_url": "https://www.amazon.in/dp/B08BVJYLZ3?tag=rioaffiliate-21",
    "landing_page_url": "",
    "candidate_score": 84.0,
    "candidate_status": "READY",
    "selected_at": "2026-08-24T21:49+05:30",
    "offer_verified_at": "2026-08-16",
    "availability": "IN_STOCK",
    "evidence_refs": [
      "data/ig_published.json",
      "data/offer_identity_registry.csv",
      "data/product_candidates.csv"
    ]
  },
  "creative": null,
  "approvals": {
    "creative": null,
    "publish": null
  },
  "publish": {
    "attempts": 1,
    "idempotency_key": "legacy:17886760158676549",
    "precheck": null,
    "media_id": "17886760158676549",
    "permalink": "https://www.instagram.com/p/Dcbect_ILPL/",
    "error": null
  },
  "governance": {
    "approval_model": "PRE_STEP_2_LEGACY",
    "legacy_import": true,
    "previous_state": null
  },
  "created_at": "2026-08-24T21:49+05:30",
  "updated_at": "2026-08-24T21:49+05:30",
  "history": [
    {
      "event_id": "ad6d174f-e5d3-515f-914a-dd002137a649",
      "campaign_id": "CMP_TROLLEY_001",
      "revision": 0,
      "action": "LEGACY_INSTAGRAM_POST_IMPORTED",
      "actor": {
        "id": "step-3-migration",
        "role": "MIGRATION"
      },
      "at": "2026-08-24T21:49+05:30",
      "from_state": null,
      "to_state": "INSTAGRAM_POSTED",
      "details": {
        "source": "data/ig_published.json",
        "approval_model": "PRE_STEP_2_LEGACY",
        "approvals_fabricated": false
      }
    }
  ]
}
