{
  "schema_version": 1,
  "campaign_id": "CMP_HOMEOFFICE_CABLE_001",
  "state": "INSTAGRAM_POSTED",
  "revision": 0,
  "identity": {
    "candidate_id": "CAND_HO_001",
    "offer_id": "HOMEOFFICE_CABLE_001",
    "merchant": "amazon.in",
    "asin": "B0FPB73FPZ",
    "product_title": "Joomouney Under Desk Cable Organizer Rack, Metal Under Table Cable Tray, Wire Management Holder for Power Extension, Power Cord, Network Cable Screw-Fixed Adjustable",
    "variant": "Metal; Screw-Fixed; Adjustable Under-Desk Tray",
    "canonical_url": "https://www.amazon.in/dp/B0FPB73FPZ",
    "affiliate_url": "https://www.amazon.in/dp/B0FPB73FPZ?tag=rioaffiliate-21",
    "landing_page_url": "",
    "candidate_score": 83.0,
    "candidate_status": "READY",
    "selected_at": "2026-09-03T22:37+05:30",
    "offer_verified_at": "2026-08-16",
    "availability": "IN_STOCK",
    "evidence_refs": [
      "data/ig_published.json",
      "data/offer_identity_registry.csv",
      "data/product_candidates.csv"
    ]
  },
  "creative": null,
  "approvals": {
    "creative": null,
    "publish": null
  },
  "publish": {
    "attempts": 1,
    "idempotency_key": "legacy:18343524478283380",
    "precheck": null,
    "media_id": "18343524478283380",
    "permalink": "https://www.instagram.com/p/Dc1T5-vCtCI/",
    "error": null
  },
  "governance": {
    "approval_model": "PRE_STEP_2_LEGACY",
    "legacy_import": true,
    "previous_state": null
  },
  "created_at": "2026-09-03T22:37+05:30",
  "updated_at": "2026-09-03T22:37+05:30",
  "history": [
    {
      "event_id": "da31d46e-e23b-5eef-a7cd-54328937171b",
      "campaign_id": "CMP_HOMEOFFICE_CABLE_001",
      "revision": 0,
      "action": "LEGACY_INSTAGRAM_POST_IMPORTED",
      "actor": {
        "id": "step-3-migration",
        "role": "MIGRATION"
      },
      "at": "2026-09-03T22:37+05:30",
      "from_state": null,
      "to_state": "INSTAGRAM_POSTED",
      "details": {
        "source": "data/ig_published.json",
        "approval_model": "PRE_STEP_2_LEGACY",
        "approvals_fabricated": false
      }
    }
  ]
}
