{
  "schema_version": 1,
  "campaign_id": "CMP_SPICE_RACK_001",
  "state": "INSTAGRAM_POSTED",
  "revision": 0,
  "identity": {
    "candidate_id": "CAND_SR_001",
    "offer_id": "SPICE_RACK_001",
    "merchant": "amazon.in",
    "asin": "B07P5Z9SQN",
    "product_title": "Amazon Solimo Plastic Revolving Spice Rack Set of 16 Pieces, Standard Size, Light Brown (SOKT66)",
    "variant": "16 pieces; Light Brown (SOKT66)",
    "canonical_url": "https://www.amazon.in/dp/B07P5Z9SQN",
    "affiliate_url": "https://www.amazon.in/dp/B07P5Z9SQN?tag=rioaffiliate-21",
    "landing_page_url": "",
    "candidate_score": 86.0,
    "candidate_status": "READY",
    "selected_at": "2026-08-28T04:32+05:30",
    "offer_verified_at": "2026-08-16",
    "availability": "IN_STOCK",
    "evidence_refs": [
      "data/ig_published.json",
      "data/offer_identity_registry.csv",
      "data/product_candidates.csv"
    ]
  },
  "creative": null,
  "approvals": {
    "creative": null,
    "publish": null
  },
  "publish": {
    "attempts": 1,
    "idempotency_key": "legacy:18109466515847072",
    "precheck": null,
    "media_id": "18109466515847072",
    "permalink": "https://www.instagram.com/p/Dcj651KFo5h/",
    "error": null
  },
  "governance": {
    "approval_model": "PRE_STEP_2_LEGACY",
    "legacy_import": true,
    "previous_state": null
  },
  "created_at": "2026-08-28T04:32+05:30",
  "updated_at": "2026-08-28T04:32+05:30",
  "history": [
    {
      "event_id": "a3352086-ffb5-56cf-bbc6-0b11f4c306da",
      "campaign_id": "CMP_SPICE_RACK_001",
      "revision": 0,
      "action": "LEGACY_INSTAGRAM_POST_IMPORTED",
      "actor": {
        "id": "step-3-migration",
        "role": "MIGRATION"
      },
      "at": "2026-08-28T04:32+05:30",
      "from_state": null,
      "to_state": "INSTAGRAM_POSTED",
      "details": {
        "source": "data/ig_published.json",
        "approval_model": "PRE_STEP_2_LEGACY",
        "approvals_fabricated": false
      }
    }
  ]
}
