{
  "schema_version": 1,
  "campaign_id": "CMP_BABY_SAFETYGATE_001",
  "state": "INSTAGRAM_POSTED",
  "revision": 0,
  "identity": {
    "candidate_id": "CAND_SG_001",
    "offer_id": "BABY_SAFETYGATE_001",
    "merchant": "amazon.in",
    "asin": "B0BHJDRK1G",
    "product_title": "Safe-O-Kid® Adjustable 1-Year Warranty Baby Safety Gate (75-95 cm) Durable Metal Child Gate for Kids, Dog Gate, Baby Gate with 2-Way Auto-Close, Secret Lock, No Drill Required",
    "variant": "75-95cm; Grey; No-Drill Pressure-Mounted",
    "canonical_url": "https://www.amazon.in/dp/B0BHJDRK1G",
    "affiliate_url": "https://www.amazon.in/dp/B0BHJDRK1G?tag=rioaffiliate-21",
    "landing_page_url": "",
    "candidate_score": 90.0,
    "candidate_status": "READY",
    "selected_at": "2026-09-07T23:50+05:30",
    "offer_verified_at": "2026-08-17",
    "availability": "IN_STOCK",
    "evidence_refs": [
      "data/ig_published.json",
      "data/offer_identity_registry.csv",
      "data/product_candidates.csv"
    ]
  },
  "creative": null,
  "approvals": {
    "creative": null,
    "publish": null
  },
  "publish": {
    "attempts": 1,
    "idempotency_key": "legacy:18087267062468859",
    "precheck": null,
    "media_id": "18087267062468859",
    "permalink": "https://www.instagram.com/p/Dc_vcruGpVm/",
    "error": null
  },
  "governance": {
    "approval_model": "PRE_STEP_2_LEGACY",
    "legacy_import": true,
    "previous_state": null
  },
  "created_at": "2026-09-07T23:50+05:30",
  "updated_at": "2026-09-07T23:50+05:30",
  "history": [
    {
      "event_id": "063c661b-55dc-5d2e-a9c8-54ca0ba8746f",
      "campaign_id": "CMP_BABY_SAFETYGATE_001",
      "revision": 0,
      "action": "LEGACY_INSTAGRAM_POST_IMPORTED",
      "actor": {
        "id": "step-3-migration",
        "role": "MIGRATION"
      },
      "at": "2026-09-07T23:50+05:30",
      "from_state": null,
      "to_state": "INSTAGRAM_POSTED",
      "details": {
        "source": "data/ig_published.json",
        "approval_model": "PRE_STEP_2_LEGACY",
        "approvals_fabricated": false
      }
    }
  ]
}
