{
  "schema_version": 1,
  "campaign_id": "CMP_BATHROOM_NODRILL_001",
  "state": "INSTAGRAM_POSTED",
  "revision": 0,
  "identity": {
    "candidate_id": "CAND_BA_002",
    "offer_id": "BATHROOM_NODRILL_001",
    "merchant": "amazon.in",
    "asin": "B0C85CTXTC",
    "product_title": "House of VIPA Wall Mounted Bathroom Shelf Organizer | 2 Tier Plastic Bathroom Rack with 4 Hooks | No Drill Adhesive Bathroom Accessories for Shampoo, Soap & Toiletries",
    "variant": "2-Tier; Plastic; 4 Hooks; No-Drill Adhesive",
    "canonical_url": "https://www.amazon.in/dp/B0C85CTXTC",
    "affiliate_url": "https://www.amazon.in/dp/B0C85CTXTC?tag=rioaffiliate-21",
    "landing_page_url": "",
    "candidate_score": 88.0,
    "candidate_status": "READY",
    "selected_at": "2026-09-02T22:46+05:30",
    "offer_verified_at": "2026-08-16",
    "availability": "IN_STOCK",
    "evidence_refs": [
      "data/ig_published.json",
      "data/offer_identity_registry.csv",
      "data/product_candidates.csv"
    ]
  },
  "creative": null,
  "approvals": {
    "creative": null,
    "publish": null
  },
  "publish": {
    "attempts": 1,
    "idempotency_key": "legacy:18434112364179396",
    "precheck": null,
    "media_id": "18434112364179396",
    "permalink": "https://www.instagram.com/p/DcywFPciVE3/",
    "error": null
  },
  "governance": {
    "approval_model": "PRE_STEP_2_LEGACY",
    "legacy_import": true,
    "previous_state": null
  },
  "created_at": "2026-09-02T22:46+05:30",
  "updated_at": "2026-09-02T22:46+05:30",
  "history": [
    {
      "event_id": "864e477e-1f0e-5bee-920b-5f55c91d6f4c",
      "campaign_id": "CMP_BATHROOM_NODRILL_001",
      "revision": 0,
      "action": "LEGACY_INSTAGRAM_POST_IMPORTED",
      "actor": {
        "id": "step-3-migration",
        "role": "MIGRATION"
      },
      "at": "2026-09-02T22:46+05:30",
      "from_state": null,
      "to_state": "INSTAGRAM_POSTED",
      "details": {
        "source": "data/ig_published.json",
        "approval_model": "PRE_STEP_2_LEGACY",
        "approvals_fabricated": false
      }
    }
  ]
}
