{
  "schema_version": 1,
  "campaign_id": "CMP_UNDER_SINK_001",
  "state": "INSTAGRAM_POSTED",
  "revision": 0,
  "identity": {
    "candidate_id": "CAND_US_001",
    "offer_id": "UNDER_SINK_001",
    "merchant": "amazon.in",
    "asin": "B0C1KNTF2Y",
    "product_title": "wolpin Under Sink Rectangle Organizer Storage Rack, 2-Tier Plastic Holder With Hooks & Cup Holder (40 x 21 x 39 cm)",
    "variant": "40 x 21 x 39 cm",
    "canonical_url": "https://www.amazon.in/dp/B0C1KNTF2Y",
    "affiliate_url": "https://www.amazon.in/dp/B0C1KNTF2Y?tag=rioaffiliate-21",
    "landing_page_url": "",
    "candidate_score": 79.0,
    "candidate_status": "READY",
    "selected_at": "2026-08-23T16:04+05:30",
    "offer_verified_at": "2026-08-16",
    "availability": "IN_STOCK",
    "evidence_refs": [
      "data/ig_published.json",
      "data/offer_identity_registry.csv",
      "data/product_candidates.csv"
    ]
  },
  "creative": null,
  "approvals": {
    "creative": null,
    "publish": null
  },
  "publish": {
    "attempts": 1,
    "idempotency_key": "legacy:17877752013535173",
    "precheck": null,
    "media_id": "17877752013535173",
    "permalink": "https://www.instagram.com/p/DcYSOe3mwhG/",
    "error": null
  },
  "governance": {
    "approval_model": "PRE_STEP_2_LEGACY",
    "legacy_import": true,
    "previous_state": null
  },
  "created_at": "2026-08-23T16:04+05:30",
  "updated_at": "2026-08-23T16:04+05:30",
  "history": [
    {
      "event_id": "b4628c28-dab1-5dfb-b9e8-c262d7127b7e",
      "campaign_id": "CMP_UNDER_SINK_001",
      "revision": 0,
      "action": "LEGACY_INSTAGRAM_POST_IMPORTED",
      "actor": {
        "id": "step-3-migration",
        "role": "MIGRATION"
      },
      "at": "2026-08-23T16:04+05:30",
      "from_state": null,
      "to_state": "INSTAGRAM_POSTED",
      "details": {
        "source": "data/ig_published.json",
        "approval_model": "PRE_STEP_2_LEGACY",
        "approvals_fabricated": false
      }
    }
  ]
}
